{
  "external_delivery_id": "D-12345",
  "pickup_address": "901 Market St, San Francisco, CA 94105",
  "pickup_business_name": "Acme Pickup Store",
  "pickup_phone_number": "+15555551234",
  "pickup_instructions": "Leave at the front desk.",
  "dropoff_address": "901 Market St, San Francisco, CA 94105",
  "dropoff_business_name": "Acme Pickup Store",
  "dropoff_phone_number": "+15555551234",
  "dropoff_instructions": "Leave at the front desk.",
  "dropoff_contact_given_name": "Acme Pickup Store",
  "dropoff_contact_family_name": "Acme Pickup Store",
  "order_value": 42,
  "tip": 42,
  "pickup_time": "2026-06-02T14:30:00Z",
  "dropoff_time": "2026-06-02T14:30:00Z",
  "contains_alcohol": true,
  "external_business_id": "D-12345",
  "external_store_id": "D-12345"
}
